{
  "document_kind": "queue_state",
  "entries": [
    {
      "assigned_resource": null,
      "bindings": {
        "contract_raw_sha256": "693d10e11845c02aaa1a531c09bcf417f183fff1cda31b7f49230a56b2f49554",
        "ledger_raw_sha256": "113b986e2541a5ba2df5c78ec7a748588e96507e0ed59039e796fbea1e52cce7",
        "preflight_report_raw_sha256": "89bec3f513d34c1e4278c620d78ca872ffa4d10a730d822ae97481db2cde9c37",
        "schema_bundle_sha256": "effe68dc6c101df2b9abf1ef4b87e30b5e5ab1c74921f2b879cd7a333460d3a2"
      },
      "dependencies": [],
      "entry_id": "100-musiceval-full",
      "experiment_id": "musiceval-full-20261003",
      "position": 1,
      "run_id": "run-20261003-musiceval100",
      "status": "ready",
      "terminal_notification_status": "not_applicable"
    }
  ],
  "queue_id": "p2-musiceval100",
  "schema_bundle_id": "harn-schema-v1",
  "schema_version": "1.0.0",
  "updated_at": "2026-10-03T12:55:46.160142+00:00"
}
