{
  "document_kind": "queue_state",
  "schema_version": "1.0.0",
  "schema_bundle_id": "harn-schema-v1",
  "queue_id": "p2-aes-diagnostic-101",
  "updated_at": "2026-10-03T12:59:10.953447+00:00",
  "entries": [
    {
      "entry_id": "101-aes-corrected",
      "position": 1,
      "experiment_id": "aes-negmf-corrected-recovery-20261003",
      "run_id": "run-20261003-101",
      "status": "ready",
      "dependencies": [],
      "assigned_resource": null,
      "bindings": {
        "contract_raw_sha256": "9b1ba72d20685f9e6b32f70aae4a8dc8be4a399811084095ba43e751678998fc",
        "preflight_report_raw_sha256": "043dfb100f37964f98086dc6cb82e74f3813a4b94559f6115d07897a5dd1a675",
        "ledger_raw_sha256": "cda7f2b2fba699f64cb8498241f29f4762e28522e93ec0457196dd21b0efc7f2",
        "schema_bundle_sha256": "effe68dc6c101df2b9abf1ef4b87e30b5e5ab1c74921f2b879cd7a333460d3a2"
      },
      "terminal_notification_status": "not_applicable"
    }
  ]
}
