{
  "document_kind": "queue_state",
  "entries": [
    {
      "assigned_resource": null,
      "bindings": {
        "contract_raw_sha256": "4e50853e88d155de4420528cbf3100b8e211c3dd9db078bc0f7ba755356ba140",
        "ledger_raw_sha256": "4de8ca252c5b0f7371d29088618552fa52e0a99edbcbe8f26965f65a08403bdd",
        "preflight_report_raw_sha256": "14f3d761cd7a0549cbef77800cdc62ada97d20bb9884843cc28a3cc79d2f5814",
        "schema_bundle_sha256": "effe68dc6c101df2b9abf1ef4b87e30b5e5ab1c74921f2b879cd7a333460d3a2"
      },
      "dependencies": [],
      "entry_id": "097-meva-shadow",
      "experiment_id": "meva095-shadow-20261003",
      "position": 1,
      "run_id": "run-20261003-095",
      "status": "completed",
      "terminal_notification_status": "delivered"
    }
  ],
  "queue_id": "p2-meva097",
  "schema_bundle_id": "harn-schema-v1",
  "schema_version": "1.0.0",
  "updated_at": "2026-10-02T20:27:53Z"
}
