{
  "document_kind": "queue_state",
  "entries": [
    {
      "assigned_resource": null,
      "bindings": {
        "contract_raw_sha256": "15694961d6e63df70eea6cbba66696c6b90b5bbf21715d2f7a77fcde2cb416a9",
        "ledger_raw_sha256": "c871cacb539b85a3d6e44f507dfaa31802d4b9fe1848c9ba69c601078815bdfb",
        "preflight_report_raw_sha256": "c1f43e2188b1d9d88293b7ef97cae90b7f42ecd95c3ccbd454207adf9df91628",
        "schema_bundle_sha256": "effe68dc6c101df2b9abf1ef4b87e30b5e5ab1c74921f2b879cd7a333460d3a2"
      },
      "dependencies": [],
      "entry_id": "103-meva-expansion",
      "experiment_id": "meva-expansion-20261004",
      "position": 1,
      "run_id": "run-20261004-meva103",
      "status": "completed",
      "terminal_notification_status": "delivered"
    }
  ],
  "queue_id": "p2-meva103",
  "schema_bundle_id": "harn-schema-v1",
  "schema_version": "1.0.0",
  "updated_at": "2026-10-05T00:05:36Z"
}
