{
  "document_kind": "queue_state",
  "entries": [
    {
      "assigned_resource": null,
      "bindings": {
        "contract_raw_sha256": "5bffe20cc5df4868e7bdda3b29fdfaa83bde5a237803f0c669571cfad6c76236",
        "ledger_raw_sha256": "f4e19471644eb88827d661bc1b00c9257c20d71ddd6bf971f1f87fe1512447cc",
        "preflight_report_raw_sha256": "085764ff03c47417c4d1da15a9bc913349d3f3324a7a9a7ff745509c93b30152",
        "schema_bundle_sha256": "effe68dc6c101df2b9abf1ef4b87e30b5e5ab1c74921f2b879cd7a333460d3a2"
      },
      "dependencies": [],
      "entry_id": "128_metric_invariance_calibration_budget_r3",
      "experiment_id": "metric-invariance-128a-20261017_budget_r3",
      "position": 1,
      "run_id": "run-20261017-128-metric-invariance_budget_r3",
      "status": "ready",
      "terminal_notification_status": "not_applicable"
    },
    {
      "assigned_resource": null,
      "bindings": {
        "contract_raw_sha256": "08ac875db3d6aaaa274dd666df41b8845c2a16c594d44815239b07a53a8832af",
        "ledger_raw_sha256": "e9b456ce52061be988cf1d85abda776efc94eecb5df57d91e872331d58c5b590",
        "preflight_report_raw_sha256": "879fe327eed54096980b1af102d7ec4c0a3347fce6c23465f350928200c972f5",
        "schema_bundle_sha256": "effe68dc6c101df2b9abf1ef4b87e30b5e5ab1c74921f2b879cd7a333460d3a2"
      },
      "dependencies": [
        "128_metric_invariance_calibration_budget_r3"
      ],
      "entry_id": "129_metric_invariance_table_b_budget_r3",
      "experiment_id": "metric-invariance-128b-20261017_budget_r3",
      "position": 2,
      "run_id": "run-20261017-129-metric-invariance_budget_r3",
      "status": "blocked",
      "terminal_notification_status": "not_applicable"
    },
    {
      "assigned_resource": null,
      "bindings": {
        "contract_raw_sha256": "0b81ece1548bcb123898e0319f5700d684a450205077b1f908120440aa4e7598",
        "ledger_raw_sha256": "8b541d5a001057a5c3628d25946b3f522a025f73c69c0fffba4c8e81862d35e3",
        "preflight_report_raw_sha256": "a81b45a21ddaf01c9786bc0daeac0c2b63ee3830af8e8a81762a7a26eec959ab",
        "schema_bundle_sha256": "effe68dc6c101df2b9abf1ef4b87e30b5e5ab1c74921f2b879cd7a333460d3a2"
      },
      "dependencies": [
        "128_metric_invariance_calibration_budget_r3",
        "129_metric_invariance_table_b_budget_r3"
      ],
      "entry_id": "130_metric_invariance_negmf_budget_r3",
      "experiment_id": "metric-invariance-128c-20261017_budget_r3",
      "position": 3,
      "run_id": "run-20261017-130-metric-invariance_budget_r3",
      "status": "blocked",
      "terminal_notification_status": "not_applicable"
    }
  ],
  "queue_id": "p2-run-20261017-129-metric-invariance_budget_r3",
  "schema_bundle_id": "harn-schema-v1",
  "schema_version": "1.0.0",
  "updated_at": "2026-10-17T01:49:00.318930+00:00"
}
